### ISSUE TITLE
max_conn不起作用

### ISSUE THREAD

**Issue by douyu** [swoole/swoole-src#821]
`swoole`设置的`max_conn`参数是20000, 但是swoole最多只能连接1000个客户端, 用户`netty`写了一个简单的`echo server`, 它可以连接超过1000客户端，所以应该不是系统限制

还发现如果max_conn设置成100, 那么只能连接75个客户端, 随着max_conn变大, 最大连接数也会变大，但是最多也就不大于1000个

系统:  `ubuntu 16.04`
swoole版本: `1.8.9`
server: `swoole_websocket_server`
文件打开限制: 
```cmd
$ ulimit -n
262140
```

**Comment by matyhtf** [comment]
`max_conn`是计算最大fd来做限制的，设置为 100需要减去管道、监听端口、信号文件等占用的fd，所以实际能建立的连接是小于100的。

设置为 20000 只能连接1000个客户端，请检测系统`ulimit -n`设置

**Comment by douyu** [comment]
并非系统ulimit限制 
```cmd
$ ulimit -n
262140
```
我先后尝试了`1.8.7/1.8.8/1.8.9/master`, 发现`1.8.8`开始就出现了这个问题

**Comment by matyhtf** [comment]
你客户端测试的方法是？

**Comment by douyu** [comment]
用的是java的异步websocket客户端框架: [https://github.com/AsyncHttpClient/async-http-client](url)

并发连接服务器, 主要代码如下: 

```java
public class App {

    private static final int MAX_CLIENTS = 1500;

    public static void main(String[] args) throws Exception {
        DefaultAsyncHttpClientConfig.Builder builder = new DefaultAsyncHttpClientConfig.Builder();
        builder.setAcceptAnyCertificate(true);
        AsyncHttpClient client = new DefaultAsyncHttpClient(builder.build());
        for (int i = 0; i < MAX_CLIENTS; i++) {
            WebSocketUpgradeHandler handler = new WebSocketUpgradeHandler.Builder()
                    .addWebSocketListener(new Agent()).build();
            try {
                client.prepareGet("ws://100.66.153.27:8765").execute(handler).get();
            } catch (Exception e) {
                e.printStackTrace();
            }
            if (i % 200 == 0) {
                Thread.sleep(100);
            }
        }
    }

}
```

**Comment by douyu** [comment]
重新编译开启debug日志后, 发现异常点

```cmd
[/root/swoole-src/src/network/Server.c:133@swServer_master_onAccept][Master] Accept new connection. maxfd=1022|reactor_id=4|conn=1023
[/root/swoole-src/src/network/ReactorThread.c:1268@swReactorThread_dispatch]send string package, size=230 bytes.
[/root/swoole-src/src/network/ReactorThread.c:1327@swReactorThread_dispatch]dispatch, type=10|len=230

[/root/swoole-src/swoole_http_server.c:888@http_onReceive]httpRequest 230 bytes:
---------------------------------------
GET / HTTP/1.1
Upgrade: WebSocket
Connection: Upgrade
Origin: http://192.168.100.143:8765
Sec-WebSocket-Key: RxZrv+ScF1dFBvEb19xYMw==
Sec-WebSocket-Version: 13
Host: 192.168.100.143:8765
Accept: */*
User-Agent: AHC/2.0



[/root/swoole-src/swoole_websocket_server.c:193@websocket_handshake]websocket header len:189
HTTP/1.1 101 Switching Protocols
Upgrade: websocket
Connection: Upgrade
Sec-WebSocket-Accept: Uyg6hQ7g4PuxwK26Qzuq99EOl8M=
Sec-WebSocket-Version: 13
Server: swoole-websocket-server

 

[/root/swoole-src/src/factory/FactoryProcess.c:253@swFactoryProcess_finish][Worker] send: sendn=201|type=0|content=HTTP/1.1 101 Switching Protocols
Upgrade: websocket
Connection: Upgrade
Sec-WebSocket-Accept: Uyg6hQ7g4PuxwK26Qzuq99EOl8M=
Sec-WebSocket-Version: 13
Server: swoole-websocket-server


[/root/swoole-src/src/network/Server.c:133@swServer_master_onAccept][Master] Accept new connection. maxfd=1023|reactor_id=4|conn=1024
[/root/swoole-src/src/network/ReactorThread.c:1268@swReactorThread_dispatch]send string package, size=230 bytes.
[/root/swoole-src/src/network/ReactorThread.c:1327@swReactorThread_dispatch]dispatch, type=10|len=230

[/root/swoole-src/src/factory/FactoryProcess.c:253@swFactoryProcess_finish][Worker] send: sendn=12|type=4|content=(null)
[/root/swoole-src/src/network/ReactorThread.c:296@swReactorThread_close]Close Event.fd=1024|from=0
[/root/swoole-src/src/network/ReactorThread.c:340@swReactorThread_close]set_maxfd=1023|close_fd=1024
```
发现后续不会再进行websocket握手了

**Comment by matyhtf** [comment]
请尝试将socket超时时间设置大一些

**Comment by douyu** [comment]
客户端请求超时设置的60s，通过抓包发现，当建立连接时客户端会立即发送一个websocket握手请求,，但是服务端回了一个ack包后就不做后续处理了

```cmd
10:12:41.471105 IP 10.1.2.103.52454 > 10.1.2.114.8765: Flags [F.], seq 4248276937, ack 342887808, win 256, length 0
	0x0000:  4500 0028 6ef6 4000 8006 72ff 0a01 0267  E..(n.@...r....g
	0x0010:  0a01 0272 cce6 223d fd37 8fc9 1470 0d80  ...r.."=.7...p..
	0x0020:  5011 0100 f7e3 0000 0000 0000 0000       P.............
10:12:41.472239 IP 10.1.2.114.8765 > 10.1.2.103.52454: Flags [F.], seq 1, ack 1, win 237, length 0
	0x0000:  4500 0028 4be0 4000 4006 d615 0a01 0272  E..(K.@.@......r
	0x0010:  0a01 0267 223d cce6 1470 0d80 fd37 8fca  ...g"=...p...7..
	0x0020:  5011 00ed 18f5 0000                      P.......
10:12:41.472588 IP 10.1.2.103.52454 > 10.1.2.114.8765: Flags [.], ack 2, win 256, length 0
	0x0000:  4500 0028 6ef7 4000 8006 72fe 0a01 0267  E..(n.@...r....g
	0x0010:  0a01 0272 cce6 223d fd37 8fca 1470 0d81  ...r.."=.7...p..
	0x0020:  5010 0100 f7e2 0000 0000 0000 0000       P.............
10:12:41.474473 IP 10.1.2.103.52467 > 10.1.2.114.8765: Flags [S], seq 4252889634, win 8192, options [mss 1460,nop,wscale 8,nop,nop,sackOK], length 0
	0x0000:  4500 0034 6ef8 4000 8006 72f1 0a01 0267  E..4n.@...r....g
	0x0010:  0a01 0272 ccf3 223d fd7d f222 0000 0000  ...r.."=.}."....
	0x0020:  8002 2000 5764 0000 0204 05b4 0103 0308  ....Wd..........
	0x0030:  0101 0402                                ....
10:12:41.474521 IP 10.1.2.114.8765 > 10.1.2.103.52467: Flags [S.], seq 68012256, ack 4252889635, win 29200, options [mss 1460,nop,nop,sackOK,nop,wscale 7], length 0
	0x0000:  4500 0034 0000 4000 4006 21ea 0a01 0272  E..4..@.@.!....r
	0x0010:  0a01 0267 223d ccf3 040d c8e0 fd7d f223  ...g"=.......}.#
	0x0020:  8012 7210 1901 0000 0204 05b4 0101 0402  ..r.............
	0x0030:  0103 0307                                ....
10:12:41.474859 IP 10.1.2.103.52467 > 10.1.2.114.8765: Flags [.], ack 1, win 256, length 0
	0x0000:  4500 0028 6ef9 4000 8006 72fc 0a01 0267  E..(n.@...r....g
	0x0010:  0a01 0272 ccf3 223d fd7d f223 040d c8e1  ...r.."=.}.#....
	0x0020:  5010 0100 ea38 0000 0000 0000 0000       P....8........
10:12:41.475275 IP 10.1.2.103.52467 > 10.1.2.114.8765: Flags [P.], seq 1:221, ack 1, win 256, length 220
	0x0000:  4500 0104 6efa 4000 8006 721f 0a01 0267  E...n.@...r....g
	0x0010:  0a01 0272 ccf3 223d fd7d f223 040d c8e1  ...r.."=.}.#....
	0x0020:  5018 0100 7bbb 0000 4745 5420 2f20 4854  P...{...GET./.HT
	0x0030:  5450 2f31 2e31 0d0a 5570 6772 6164 653a  TP/1.1..Upgrade:
	0x0040:  2057 6562 536f 636b 6574 0d0a 436f 6e6e  .WebSocket..Conn
	0x0050:  6563 7469 6f6e 3a20 5570 6772 6164 650d  ection:.Upgrade.
	0x0060:  0a4f 7269 6769 6e3a 2068 7474 703a 2f2f  .Origin:.http://
	0x0070:  3130 2e31 2e32 2e31 3134 3a38 3736 350d  10.1.2.114:8765.
	0x0080:  0a53 6563 2d57 6562 536f 636b 6574 2d4b  .Sec-WebSocket-K
	0x0090:  6579 3a20 634a 4252 392f 4c65 6a6c 446d  ey:.cJBR9/LejlDm
	0x00a0:  7646 6e50 6762 4776 2f41 3d3d 0d0a 5365  vFnPgbGv/A==..Se
	0x00b0:  632d 5765 6253 6f63 6b65 742d 5665 7273  c-WebSocket-Vers
	0x00c0:  696f 6e3a 2031 330d 0a48 6f73 743a 2031  ion:.13..Host:.1
	0x00d0:  302e 312e 322e 3131 343a 3837 3635 0d0a  0.1.2.114:8765..
	0x00e0:  4163 6365 7074 3a20 2a2f 2a0d 0a55 7365  Accept:.*/*..Use
	0x00f0:  722d 4167 656e 743a 2041 4843 2f32 2e30  r-Agent:.AHC/2.0
	0x0100:  0d0a 0d0a                                ....
10:12:41.475364 IP 10.1.2.114.8765 > 10.1.2.103.52467: Flags [.], ack 221, win 237, length 0
	0x0000:  4500 0028 4806 4000 4006 d9ef 0a01 0272  E..(H.@.@......r
	0x0010:  0a01 0267 223d ccf3 040d c8e1 fd7d f2ff  ...g"=.......}..
	0x0020:  5010 00ed 18f5 0000                      P.......
```

**Comment by matyhtf** [comment]
端口设置为SSL，但是客户端是明文？

**Comment by douyu** [comment]
不是的，这个测试都是明文，循环发起1500个客户端连接，大概到连1000左右时就触发了这个问题，启用ssl也同样有这个问题

**Comment by matyhtf** [comment]
感谢反馈。这个问题我跟踪一下

**Comment by matyhtf** [comment]
确实存在BUG，底层的一个数据结构读取存在问题，已修复。
