### ISSUE TITLE
swoole server 和client的连接 握手过程，为什么会重复？

### ISSUE THREAD

**Issue by nick-william** [swoole/swoole-src#827]
11:27:40.202981 IP 127.0.0.1.56232 > 127.0.0.1.9501: Flags [S], seq 433483527, win 65535, options [mss 16344,nop,wscale 5,nop,nop,TS val 282961161 ecr 0,sackOK,eol], length 0
....E..@xw@.@.............%...o..........4....?........
...	........
11:27:40.202992 IP 127.0.0.1.56232 > 127.0.0.1.9501: Flags [S], seq 433483527, win 65535, options [mss 16344,nop,wscale 5,nop,nop,TS val 282961161 ecr 0,sackOK,eol], length 0
....E..@xw@.@.............%...o..........4....?........
...	........
11:27:40.203055 IP 127.0.0.1.9501 > 127.0.0.1.56232: Flags [S.], seq 3934399173, ack 433483528, win 65535, options [mss 16344,nop,wscale 5,nop,nop,TS val 282961161 ecr 282961161,sackOK,eol], length 0
....E..@..@.@...........%.....*...o......4....?........
...	...	....
11:27:40.203058 IP 127.0.0.1.9501 > 127.0.0.1.56232: Flags [S.], seq 3934399173, ack 433483528, win 65535, options [mss 16344,nop,wscale 5,nop,nop,TS val 282961161 ecr 282961161,sackOK,eol], length 0
....E..@..@.@...........%.....*...o......4....?........
...	...	....
11:27:40.203070 IP 127.0.0.1.56232 > 127.0.0.1.9501: Flags [.], ack 1, win 12759, options [nop,nop,TS val 282961161 ecr 282961161], length 0
....E..4M.@.@.............%...o...*...1..(.....
...	...	
11:27:40.203071 IP 127.0.0.1.56232 > 127.0.0.1.9501: Flags [.], ack 1, win 12759, options [nop,nop,TS val 282961161 ecr 282961161], length 0
....E..4M.@.@.............%...o...*...1..(.....
...	...	
11:27:40.203082 IP 127.0.0.1.9501 > 127.0.0.1.56232: Flags [.], ack 1, win 12759, options [nop,nop,TS val 282961161 ecr 282961161], length 0
....E..4..@.@...........%.....*...o...1..(.....
...	...	
11:27:40.203084 IP 127.0.0.1.9501 > 127.0.0.1.56232: Flags [.], ack 1, win 12759, options [nop,nop,TS val 282961161 ecr 282961161], length 0

**Comment by nick-william** [comment]
运行的代码，是swoole-src中的，example 中的 server\echo.php 和 client\sync.php(去除循环)

**Comment by nick-william** [comment]
出现重复的是在macos下，在linux上tcpdump抓包没有出现这样的问题。
如果韩老师觉得不需要调试，就close

**Comment by matyhtf** [comment]
这个可能和操作系统有关，暂时还不清楚原因，如果程序逻辑正确，那可以认为没问题
