### ISSUE TITLE
fopen(URL): failed to open stream: HTTP request failed!

### ISSUE THREAD

**Issue by 0x2e** [swoole/swoole-src#1030]
这个问题不是必然出现，在我本地的虚拟机环境（Ubuntu16.04）出现的概率很高（20%左右），从抓包的情况看HTTP的请求数据包已发完整，但服务端没有返回响应数据包。
 不清楚这是swoole的问题，还是其他什么原因，麻烦 @matyhtf 能给一个合理的解释。

## 服务端代码(php-7.0.13, swoole-1.9.1)
```php
<?php

date_default_timezone_set('Asia/Shanghai');

$host = '127.0.0.1';
$port = 4201;

$server = new swoole_http_server($host, $port);
$server->on('request', function ($request, $response) {
    $logFile = __DIR__.'/server.log';
    $logMessage = sprintf(
        "[%s] client=%s:%d\n",
        date('Y-m-d H:i:s'),
        $request->server['remote_addr'],
        $request->server['remote_port']
    );
    file_put_contents($logFile, $logMessage, FILE_APPEND);
    $response->end($request->rawContent());
});

$server->start();
```

## 客户端代码(php-5.6.29)
```php
<?php

date_default_timezone_set('Asia/Shanghai');

$data1 = str_repeat('#', 10);
$data2 = str_repeat('#', 20);

$url = 'http://127.0.0.1:4201';

$context1 = stream_context_create([
    'http' => [
        'method' => 'POST',
        'header' => "Content-Type: application/x-www-form-urlencoded\r\nConnection: close\r\n",
        'content' => $data1,
        'ignore_errors' => true,
        'follow_location' => 0,
        'protocol_version' => 1.1,
        'timeout' => 10,
    ],
]);

$context2 = stream_context_create([
    'http' => [
        'method' => 'POST',
        'header' => "Content-Type: application/x-www-form-urlencoded\r\nConnection: close\r\n",
        'content' => $data2,
        'ignore_errors' => true,
        'follow_location' => 0,
        'protocol_version' => 1.1,
        'timeout' => 10,
    ],
]);

var_dump(date('Y-m-d H:i:s'));

var_dump($fp = fopen($url, 'r', null, $context1));
var_dump(stream_get_contents($fp));
var_dump(stream_get_meta_data($fp));

var_dump(date('Y-m-d H:i:s'));

var_dump($fp = fopen($url, 'r', null, $context2));
var_dump(stream_get_contents($fp));
var_dump(stream_get_meta_data($fp));

var_dump(date('Y-m-d H:i:s'));
```
## 客户端请求结果

```
string(19) "2017-01-19 08:42:56"

Warning: fopen(http://127.0.0.1:4201): failed to open stream: HTTP request failed!  in /data/src/php-5.6.29/client.php on line 36
bool(false)

Warning: stream_get_contents() expects parameter 1 to be resource, boolean given in /data/src/php-5.6.29/client.php on line 37
bool(false)

Warning: stream_get_meta_data() expects parameter 1 to be resource, boolean given in /data/src/php-5.6.29/client.php on line 38
NULL
string(19) "2017-01-19 08:43:16"
resource(7) of type (stream)
string(10) "##########"
array(10) {
  ["timed_out"]=>
  bool(false)
  ["blocked"]=>
  bool(true)
  ["eof"]=>
  bool(true)
  ["wrapper_data"]=>
  array(6) {
    [0]=>
    string(15) "HTTP/1.1 200 OK"
    [1]=>
    string(26) "Server: swoole-http-server"
    [2]=>
    string(23) "Content-Type: text/html"
    [3]=>
    string(17) "Connection: close"
    [4]=>
    string(35) "Date: Thu, 19 Jan 2017 00:43:16 GMT"
    [5]=>
    string(18) "Content-Length: 10"
  }
  ["wrapper_type"]=>
  string(4) "http"
  ["stream_type"]=>
  string(10) "tcp_socket"
  ["mode"]=>
  string(1) "r"
  ["unread_bytes"]=>
  int(0)
  ["seekable"]=>
  bool(false)
  ["uri"]=>
  string(21) "http://127.0.0.1:4201"
}
string(19) "2017-01-19 08:43:17"
```

## 服务端日志(server.log)

```
[2017-01-19 08:43:16] client=127.0.0.1:46048
```

## TCP数据包(ngrep -e tcp -d lo -T -v)

```
T +681.806274 127.0.0.1:46046 -> 127.0.0.1:4201 [S]
#
T +0.000007 127.0.0.1:4201 -> 127.0.0.1:46046 [AS]
#
T +0.000006 127.0.0.1:46046 -> 127.0.0.1:4201 [A]
#
T +0.000955 127.0.0.1:46046 -> 127.0.0.1:4201 [AP]
  POST / HTTP/1.1..
#
T +0.000006 127.0.0.1:4201 -> 127.0.0.1:46046 [A]
#
T +0.000403 127.0.0.1:46046 -> 127.0.0.1:4201 [AP]
  Host: 127.0.0.1:4201..
#
T +0.000004 127.0.0.1:4201 -> 127.0.0.1:46046 [A]
#
T +0.000015 127.0.0.1:46046 -> 127.0.0.1:4201 [AP]
  Content-Length: 10..
#
T +0.000002 127.0.0.1:4201 -> 127.0.0.1:46046 [A]
#
T +0.000007 127.0.0.1:46046 -> 127.0.0.1:4201 [AP]
  Content-Type: application/x-www-form-urlencoded..Connection: close
#
T +0.000001 127.0.0.1:4201 -> 127.0.0.1:46046 [A]
#
T +0.000006 127.0.0.1:46046 -> 127.0.0.1:4201 [AP]
  ..
#
T +0.000002 127.0.0.1:4201 -> 127.0.0.1:46046 [A]
#
T +0.000006 127.0.0.1:46046 -> 127.0.0.1:4201 [AP]
  ..
#
T +0.000001 127.0.0.1:4201 -> 127.0.0.1:46046 [A]
#
T +0.000006 127.0.0.1:46046 -> 127.0.0.1:4201 [AP]
  ##########
#
T +0.000001 127.0.0.1:4201 -> 127.0.0.1:46046 [A]
#
T +20.020163 127.0.0.1:46046 -> 127.0.0.1:4201 [AF]
#
T +0.000070 127.0.0.1:4201 -> 127.0.0.1:46046 [AF]
#
T +0.000012 127.0.0.1:46046 -> 127.0.0.1:4201 [A]
#
T +0.043183 127.0.0.1:46048 -> 127.0.0.1:4201 [S]
#
T +0.000011 127.0.0.1:4201 -> 127.0.0.1:46048 [AS]
#
T +0.000010 127.0.0.1:46048 -> 127.0.0.1:4201 [A]
#
T +0.000196 127.0.0.1:46048 -> 127.0.0.1:4201 [AP]
  POST / HTTP/1.1..
#
T +0.000692 127.0.0.1:4201 -> 127.0.0.1:46048 [A]
#
T +0.000078 127.0.0.1:46048 -> 127.0.0.1:4201 [AP]
  Host: 127.0.0.1:4201..
#
T +0.000006 127.0.0.1:4201 -> 127.0.0.1:46048 [A]
#
T +0.000014 127.0.0.1:46048 -> 127.0.0.1:4201 [AP]
  Content-Length: 20..
#
T +0.000002 127.0.0.1:4201 -> 127.0.0.1:46048 [A]
#
T +0.000006 127.0.0.1:46048 -> 127.0.0.1:4201 [AP]
  Content-Type: application/x-www-form-urlencoded..Connection: close
#
T +0.000002 127.0.0.1:4201 -> 127.0.0.1:46048 [A]
#
T +0.000006 127.0.0.1:46048 -> 127.0.0.1:4201 [AP]
  ..
#
T +0.000002 127.0.0.1:4201 -> 127.0.0.1:46048 [A]
#
T +0.000006 127.0.0.1:46048 -> 127.0.0.1:4201 [AP]
  ..
#
T +0.000001 127.0.0.1:4201 -> 127.0.0.1:46048 [A]
#
T +0.000006 127.0.0.1:46048 -> 127.0.0.1:4201 [AP]
  ####################
#
T +0.000002 127.0.0.1:4201 -> 127.0.0.1:46048 [A]
#
T +0.002827 127.0.0.1:4201 -> 127.0.0.1:46048 [AP]
  HTTP/1.1 200 OK..Server: swoole-http-server..Content-Type: text/html..Connection: close..Date: Thu, 19 Jan 2017 00:43:16 GMT..Content-Length: 10....##########
#
T +0.000006 127.0.0.1:46048 -> 127.0.0.1:4201 [A]
#
T +0.000013 127.0.0.1:4201 -> 127.0.0.1:46048 [AF]
#
T +0.029525 127.0.0.1:46048 -> 127.0.0.1:4201 [AF]
#
T +0.000020 127.0.0.1:4201 -> 127.0.0.1:46048 [A]

```

## TCP数据包(tcpdump tcp -i lo -A -XX)

这是之前抓取的数据，非上面的请求。

```
23:50:47.053949 IP localhost.45278 > localhost.4201: Flags [S], seq 3528418811, win 43690, options [mss 65495,sackOK,TS val 23904873 ecr 0,nop,wscale 7], length 0
    0x0000:  0000 0000 0000 0000 0000 0000 0800 4500  ..............E.
    0x0010:  003c a792 4000 4006 9527 7f00 0001 7f00  .<..@.@..'......
    0x0020:  0001 b0de 1069 d24f 65fb 0000 0000 a002  .....i.Oe.......
    0x0030:  aaaa fe30 0000 0204 ffd7 0402 080a 016c  ...0...........l
    0x0040:  c269 0000 0000 0103 0307                 .i........
23:50:47.053959 IP localhost.4201 > localhost.45278: Flags [S.], seq 2236899010, ack 3528418812, win 43690, options [mss 65495,sackOK,TS val 23904873 ecr 23904873,nop,wscale 7], length 0
    0x0000:  0000 0000 0000 0000 0000 0000 0800 4500  ..............E.
    0x0010:  003c 0000 4000 4006 3cba 7f00 0001 7f00  .<..@.@.<.......
    0x0020:  0001 1069 b0de 8554 5ec2 d24f 65fc a012  ...i...T^..Oe...
    0x0030:  aaaa fe30 0000 0204 ffd7 0402 080a 016c  ...0...........l
    0x0040:  c269 016c c269 0103 0307                 .i.l.i....
23:50:47.053967 IP localhost.45278 > localhost.4201: Flags [.], ack 1, win 342, options [nop,nop,TS val 23904873 ecr 23904873], length 0
    0x0000:  0000 0000 0000 0000 0000 0000 0800 4500  ..............E.
    0x0010:  0034 a793 4000 4006 952e 7f00 0001 7f00  .4..@.@.........
    0x0020:  0001 b0de 1069 d24f 65fc 8554 5ec3 8010  .....i.Oe..T^...
    0x0030:  0156 fe28 0000 0101 080a 016c c269 016c  .V.(.......l.i.l
    0x0040:  c269                                     .i
23:50:47.055228 IP localhost.45278 > localhost.4201: Flags [P.], seq 1:18, ack 1, win 342, options [nop,nop,TS val 23904873 ecr 23904873], length 17
    0x0000:  0000 0000 0000 0000 0000 0000 0800 4500  ..............E.
    0x0010:  0045 a794 4000 4006 951c 7f00 0001 7f00  .E..@.@.........
    0x0020:  0001 b0de 1069 d24f 65fc 8554 5ec3 8018  .....i.Oe..T^...
    0x0030:  0156 fe39 0000 0101 080a 016c c269 016c  .V.9.......l.i.l
    0x0040:  c269 504f 5354 202f 2048 5454 502f 312e  .iPOST./.HTTP/1.
    0x0050:  310d 0a                                  1..
23:50:47.055241 IP localhost.4201 > localhost.45278: Flags [.], ack 18, win 342, options [nop,nop,TS val 23904873 ecr 23904873], length 0
    0x0000:  0000 0000 0000 0000 0000 0000 0800 4500  ..............E.
    0x0010:  0034 9caa 4000 4006 a017 7f00 0001 7f00  .4..@.@.........
    0x0020:  0001 1069 b0de 8554 5ec3 d24f 660d 8010  ...i...T^..Of...
    0x0030:  0156 fe28 0000 0101 080a 016c c269 016c  .V.(.......l.i.l
    0x0040:  c269                                     .i
23:50:47.056039 IP localhost.45278 > localhost.4201: Flags [P.], seq 18:40, ack 1, win 342, options [nop,nop,TS val 23904873 ecr 23904873], length 22
    0x0000:  0000 0000 0000 0000 0000 0000 0800 4500  ..............E.
    0x0010:  004a a795 4000 4006 9516 7f00 0001 7f00  .J..@.@.........
    0x0020:  0001 b0de 1069 d24f 660d 8554 5ec3 8018  .....i.Of..T^...
    0x0030:  0156 fe3e 0000 0101 080a 016c c269 016c  .V.>.......l.i.l
    0x0040:  c269 486f 7374 3a20 3132 372e 302e 302e  .iHost:.127.0.0.
    0x0050:  313a 3432 3031 0d0a                      1:4201..
23:50:47.056048 IP localhost.4201 > localhost.45278: Flags [.], ack 40, win 342, options [nop,nop,TS val 23904873 ecr 23904873], length 0
    0x0000:  0000 0000 0000 0000 0000 0000 0800 4500  ..............E.
    0x0010:  0034 9cab 4000 4006 a016 7f00 0001 7f00  .4..@.@.........
    0x0020:  0001 1069 b0de 8554 5ec3 d24f 6623 8010  ...i...T^..Of#..
    0x0030:  0156 fe28 0000 0101 080a 016c c269 016c  .V.(.......l.i.l
    0x0040:  c269                                     .i
23:51:07.076853 IP localhost.45278 > localhost.4201: Flags [F.], seq 186, ack 1, win 342, options [nop,nop,TS val 23909878 ecr 23904873], length 0
    0x0000:  0000 0000 0000 0000 0000 0000 0800 4500  ..............E.
    0x0010:  0034 a79b 4000 4006 9526 7f00 0001 7f00  .4..@.@..&......
    0x0020:  0001 b0de 1069 d24f 66b5 8554 5ec3 8011  .....i.Of..T^...
    0x0030:  0156 fe28 0000 0101 080a 016c d5f6 016c  .V.(.......l...l
    0x0040:  c269                                     .i
23:51:07.076989 IP localhost.4201 > localhost.45278: Flags [F.], seq 1, ack 187, win 342, options [nop,nop,TS val 23909878 ecr 23909878], length 0
    0x0000:  0000 0000 0000 0000 0000 0000 0800 4500  ..............E.
    0x0010:  0034 9cb1 4000 4006 a010 7f00 0001 7f00  .4..@.@.........
    0x0020:  0001 1069 b0de 8554 5ec3 d24f 66b6 8011  ...i...T^..Of...
    0x0030:  0156 fe28 0000 0101 080a 016c d5f6 016c  .V.(.......l...l
    0x0040:  d5f6                                     ..
23:51:07.077001 IP localhost.45278 > localhost.4201: Flags [.], ack 2, win 342, options [nop,nop,TS val 23909878 ecr 23909878], length 0
    0x0000:  0000 0000 0000 0000 0000 0000 0800 4500  ..............E.
    0x0010:  0034 a79c 4000 4006 9525 7f00 0001 7f00  .4..@.@..%......
    0x0020:  0001 b0de 1069 d24f 66b6 8554 5ec4 8010  .....i.Of..T^...
    0x0030:  0156 fe28 0000 0101 080a 016c d5f6 016c  .V.(.......l...l
    0x0040:  d5f6                                     ..
23:51:07.078359 IP localhost.45280 > localhost.4201: Flags [S], seq 139739715, win 43690, options [mss 65495,sackOK,TS val 23909879 ecr 0,nop,wscale 7], length 0
    0x0000:  0000 0000 0000 0000 0000 0000 0800 4500  ..............E.
    0x0010:  003c 97b4 4000 4006 a505 7f00 0001 7f00  .<..@.@.........
    0x0020:  0001 b0e0 1069 0854 4243 0000 0000 a002  .....i.TBC......
    0x0030:  aaaa fe30 0000 0204 ffd7 0402 080a 016c  ...0...........l
    0x0040:  d5f7 0000 0000 0103 0307                 ..........
23:51:07.078370 IP localhost.4201 > localhost.45280: Flags [S.], seq 2357207941, ack 139739716, win 43690, options [mss 65495,sackOK,TS val 23909879 ecr 23909879,nop,wscale 7], length 0
    0x0000:  0000 0000 0000 0000 0000 0000 0800 4500  ..............E.
    0x0010:  003c 0000 4000 4006 3cba 7f00 0001 7f00  .<..@.@.<.......
    0x0020:  0001 1069 b0e0 8c80 2385 0854 4244 a012  ...i....#..TBD..
    0x0030:  aaaa fe30 0000 0204 ffd7 0402 080a 016c  ...0...........l
    0x0040:  d5f7 016c d5f7 0103 0307                 ...l......
23:51:07.078378 IP localhost.45280 > localhost.4201: Flags [.], ack 1, win 342, options [nop,nop,TS val 23909879 ecr 23909879], length 0
    0x0000:  0000 0000 0000 0000 0000 0000 0800 4500  ..............E.
    0x0010:  0034 97b5 4000 4006 a50c 7f00 0001 7f00  .4..@.@.........
    0x0020:  0001 b0e0 1069 0854 4244 8c80 2386 8010  .....i.TBD..#...
    0x0030:  0156 fe28 0000 0101 080a 016c d5f7 016c  .V.(.......l...l
    0x0040:  d5f7                                     ..
23:51:07.078424 IP localhost.45280 > localhost.4201: Flags [P.], seq 1:18, ack 1, win 342, options [nop,nop,TS val 23909879 ecr 23909879], length 17
    0x0000:  0000 0000 0000 0000 0000 0000 0800 4500  ..............E.
    0x0010:  0045 97b6 4000 4006 a4fa 7f00 0001 7f00  .E..@.@.........
    0x0020:  0001 b0e0 1069 0854 4244 8c80 2386 8018  .....i.TBD..#...
    0x0030:  0156 fe39 0000 0101 080a 016c d5f7 016c  .V.9.......l...l
    0x0040:  d5f7 504f 5354 202f 2048 5454 502f 312e  ..POST./.HTTP/1.
    0x0050:  310d 0a                                  1..
23:51:07.078756 IP localhost.4201 > localhost.45280: Flags [P.], seq 1:169, ack 196, win 342, options [nop,nop,TS val 23909879 ecr 23909879], length 168
    0x0000:  0000 0000 0000 0000 0000 0000 0800 4500  ..............E.
    0x0010:  00dc f678 4000 4006 45a1 7f00 0001 7f00  ...x@.@.E.......
    0x0020:  0001 1069 b0e0 8c80 2386 0854 4307 8018  ...i....#..TC...
    0x0030:  0156 fed0 0000 0101 080a 016c d5f7 016c  .V.........l...l
    0x0040:  d5f7 4854 5450 2f31 2e31 2032 3030 204f  ..HTTP/1.1.200.O
    0x0050:  4b0d 0a53 6572 7665 723a 2073 776f 6f6c  K..Server:.swool
    0x0060:  652d 6874 7470 2d73 6572 7665 720d 0a43  e-http-server..C
    0x0070:  6f6e 7465 6e74 2d54 7970 653a 2074 6578  ontent-Type:.tex
    0x0080:  742f 6874 6d6c 0d0a 436f 6e6e 6563 7469  t/html..Connecti
    0x0090:  6f6e 3a20 636c 6f73 650d 0a44 6174 653a  on:.close..Date:
    0x00a0:  2057 6564 2c20 3138 204a 616e 2032 3031  .Wed,.18.Jan.201
    0x00b0:  3720 3233 3a35 313a 3037 2047 4d54 0d0a  7.23:51:07.GMT..
    0x00c0:  436f 6e74 656e 742d 4c65 6e67 7468 3a20  Content-Length:.
    0x00d0:  3230 0d0a 0d0a 2323 2323 2323 2323 2323  20....##########
    0x00e0:  2323 2323 2323 2323 2323                 ##########
23:51:07.078763 IP localhost.45280 > localhost.4201: Flags [.], ack 169, win 350, options [nop,nop,TS val 23909879 ecr 23909879], length 0
    0x0000:  0000 0000 0000 0000 0000 0000 0800 4500  ..............E.
    0x0010:  0034 97bd 4000 4006 a504 7f00 0001 7f00  .4..@.@.........
    0x0020:  0001 b0e0 1069 0854 4307 8c80 242e 8010  .....i.TC...$...
    0x0030:  015e fe28 0000 0101 080a 016c d5f7 016c  .^.(.......l...l
    0x0040:  d5f7                                     ..
23:51:07.078921 IP localhost.4201 > localhost.45280: Flags [F.], seq 169, ack 196, win 342, options [nop,nop,TS val 23909879 ecr 23909879], length 0
    0x0000:  0000 0000 0000 0000 0000 0000 0800 4500  ..............E.
    0x0010:  0034 f679 4000 4006 4648 7f00 0001 7f00  .4.y@.@.FH......
    0x0020:  0001 1069 b0e0 8c80 242e 0854 4307 8011  ...i....$..TC...
    0x0030:  0156 fe28 0000 0101 080a 016c d5f7 016c  .V.(.......l...l
    0x0040:  d5f7                                     ..
23:51:07.080909 IP localhost.45280 > localhost.4201: Flags [F.], seq 196, ack 170, win 350, options [nop,nop,TS val 23909879 ecr 23909879], length 0
    0x0000:  0000 0000 0000 0000 0000 0000 0800 4500  ..............E.
    0x0010:  0034 97be 4000 4006 a503 7f00 0001 7f00  .4..@.@.........
    0x0020:  0001 b0e0 1069 0854 4307 8c80 242f 8011  .....i.TC...$/..
    0x0030:  015e fe28 0000 0101 080a 016c d5f7 016c  .^.(.......l...l
    0x0040:  d5f7                                     ..
23:51:07.080924 IP localhost.4201 > localhost.45280: Flags [.], ack 197, win 342, options [nop,nop,TS val 23909879 ecr 23909879], length 0
    0x0000:  0000 0000 0000 0000 0000 0000 0800 4500  ..............E.
    0x0010:  0034 f67a 4000 4006 4647 7f00 0001 7f00  .4.z@.@.FG......
    0x0020:  0001 1069 b0e0 8c80 242f 0854 4308 8010  ...i....$/.TC...
    0x0030:  0156 fe28 0000 0101 080a 016c d5f7 016c  .V.(.......l...l
    0x0040:  d5f7                                     ..
```

**Comment by matyhtf** [comment]
tcpdump的信息看，Server已经发送了响应内容。检查swoole的log_file错误日志和PHP错误日志，寻找信息

**Comment by 0x2e** [comment]
@matyhtf 客户端发起两次请求，第一次失败，第二次成功。tcpdump只有第二次的响应。
```
...
23:50:47.056048 IP localhost.4201 > localhost.45278: Flags [.], ack 40, win 342, options [nop,nop,TS val 23904873 ecr 23904873], length 0
    0x0000:  0000 0000 0000 0000 0000 0000 0800 4500  ..............E.
    0x0010:  0034 9cab 4000 4006 a016 7f00 0001 7f00  .4..@.@.........
    0x0020:  0001 1069 b0de 8554 5ec3 d24f 6623 8010  ...i...T^..Of#..
    0x0030:  0156 fe28 0000 0101 080a 016c c269 016c  .V.(.......l.i.l
    0x0040:  c269                                     .i
# 这里客户端等到超时也没收到消息
23:51:07.076853 IP localhost.45278 > localhost.4201: Flags [F.], seq 186, ack 1, win 342, options [nop,nop,TS val 23909878 ecr 23904873], length 0
    0x0000:  0000 0000 0000 0000 0000 0000 0800 4500  ..............E.
    0x0010:  0034 a79b 4000 4006 9526 7f00 0001 7f00  .4..@.@..&......
    0x0020:  0001 b0de 1069 d24f 66b5 8554 5ec3 8011  .....i.Of..T^...
    0x0030:  0156 fe28 0000 0101 080a 016c d5f6 016c  .V.(.......l...l
    0x0040:  c269                                     .i
...
```

**Comment by matyhtf** [comment]
strace 跟踪进程

**Comment by 0x2e** [comment]
晚点我跟踪下，另外从上面的ngrep看，数据包好像是发串了，第二次请求发的是第一次的响应。

**Comment by 0x2e** [comment]
@matyhtf 下面是master进程的strace的日志 

`strace -p 29563 -f -F`

```
...
[pid 29563] epoll_wait(7, [], 4096, 1000) = 0
[pid 29563] epoll_wait(7, [], 4096, 1000) = 0
[pid 29563] epoll_wait(7, [], 4096, 1000) = 0
[pid 29563] epoll_wait(7, [{EPOLLIN, {u32=4, u64=4294967300}}], 4096, 1000) = 1
[pid 29563] accept4(4, {sa_family=AF_INET, sin_port=htons(46564), sin_addr=inet_addr("127.0.0.1")}, [16], SOCK_CLOEXEC|SOCK_NONBLOCK) = 10
[pid 29563] epoll_ctl(9, EPOLL_CTL_ADD, 10, {EPOLLIN, {u32=10, u64=10}}) = 0
[pid 29563] accept4(4, 0x7fff6491f250, 0x7fff6491f248, SOCK_CLOEXEC|SOCK_NONBLOCK) = -1 EAGAIN (Resource temporarily unavailable)
[pid 29563] epoll_wait(7,  <unfinished ...>
[pid 29565] <... epoll_wait resumed> [{EPOLLIN, {u32=10, u64=10}}], 4096, -1) = 1
[pid 29565] recvfrom(10, "POST / HTTP/1.1\r\n", 8192, 0, NULL, NULL) = 17
[pid 29565] recvfrom(10, 0x7f0dcc00ea71, 8175, 0, NULL, NULL) = -1 EAGAIN (Resource temporarily unavailable)
[pid 29565] epoll_wait(9, [{EPOLLIN, {u32=10, u64=10}}], 4096, -1) = 1
[pid 29565] recvfrom(10, "Host: 127.0.0.1:4201\r\n", 8175, 0, NULL, NULL) = 22
[pid 29565] recvfrom(10, 0x7f0dcc00ea87, 8153, 0, NULL, NULL) = -1 EAGAIN (Resource temporarily unavailable)
[pid 29565] epoll_wait(9, [{EPOLLIN, {u32=10, u64=10}}], 4096, -1) = 1
[pid 29565] recvfrom(10, "Content-Length: 10\r\n", 8153, 0, NULL, NULL) = 20
[pid 29565] recvfrom(10, 0x7f0dcc00ea9b, 8133, 0, NULL, NULL) = -1 EAGAIN (Resource temporarily unavailable)
[pid 29565] epoll_wait(9, [{EPOLLIN, {u32=10, u64=10}}], 4096, -1) = 1
[pid 29565] recvfrom(10, "Content-Type: application/x-www-"..., 8133, 0, NULL, NULL) = 66
[pid 29565] recvfrom(10, 0x7f0dcc00eadd, 8067, 0, NULL, NULL) = -1 EAGAIN (Resource temporarily unavailable)
[pid 29565] epoll_wait(9, [{EPOLLIN, {u32=10, u64=10}}], 4096, -1) = 1
[pid 29565] recvfrom(10, "\r\n\r\n", 8067, 0, NULL, NULL) = 4
[pid 29565] recvfrom(10, 0x7f0dcc00eae1, 8063, 0, NULL, NULL) = -1 EAGAIN (Resource temporarily unavailable)
[pid 29565] epoll_wait(9, [{EPOLLIN, {u32=10, u64=10}}], 4096, -1) = 1
[pid 29565] recvfrom(10, "##########", 8063, 0, NULL, NULL) = 10
--> 这里应该要将HTTP请求发给worker进程
[pid 29565] recvfrom(10, 0x7f0dcc00eaeb, 8053, 0, NULL, NULL) = -1 EAGAIN (Resource temporarily unavailable)
[pid 29565] epoll_wait(9,  <unfinished ...>
[pid 29563] <... epoll_wait resumed> [], 4096, 1000) = 0
[pid 29563] epoll_wait(7, [], 4096, 1000) = 0
[pid 29563] epoll_wait(7, [], 4096, 1000) = 0
[pid 29563] epoll_wait(7, [], 4096, 1000) = 0
[pid 29563] epoll_wait(7, [], 4096, 1000) = 0
[pid 29563] epoll_wait(7, [], 4096, 1000) = 0
[pid 29563] epoll_wait(7, [], 4096, 1000) = 0
[pid 29563] epoll_wait(7, [], 4096, 1000) = 0
[pid 29563] epoll_wait(7, [], 4096, 1000) = 0
[pid 29563] epoll_wait(7, [], 4096, 1000) = 0
[pid 29563] epoll_wait(7, [], 4096, 1000) = 0
[pid 29563] epoll_wait(7, [], 4096, 1000) = 0
[pid 29563] epoll_wait(7, [], 4096, 1000) = 0
[pid 29563] epoll_wait(7, [], 4096, 1000) = 0
[pid 29563] epoll_wait(7, [], 4096, 1000) = 0
[pid 29563] epoll_wait(7, [], 4096, 1000) = 0
[pid 29563] epoll_wait(7, [], 4096, 1000) = 0
[pid 29563] epoll_wait(7, [], 4096, 1000) = 0
[pid 29563] epoll_wait(7, [], 4096, 1000) = 0
[pid 29563] epoll_wait(7,  <unfinished ...>
[pid 29565] <... epoll_wait resumed> [{EPOLLIN, {u32=10, u64=10}}], 4096, -1) = 1
[pid 29565] recvfrom(10, "", 8053, 0, NULL, NULL) = 0
[pid 29565] epoll_ctl(9, EPOLL_CTL_DEL, 10, NULL) = 0
[pid 29565] write(6, "!\0\0\0\0\0\0\0\4\0\4\0", 12) = 12
[pid 29565] epoll_wait(9, [{EPOLLIN, {u32=6, u64=21474836486}}], 4096, -1) = 1
[pid 29565] read(6, "!\0\0\0\0\0\0\0\4\0\0\0", 8192) = 12
[pid 29565] close(10)                   = 0
[pid 29565] read(6, 0x7f0dd2d6cd70, 8192) = -1 EAGAIN (Resource temporarily unavailable)
[pid 29565] epoll_wait(9,  <unfinished ...>
[pid 29563] <... epoll_wait resumed> [{EPOLLIN, {u32=4, u64=4294967300}}], 4096, 1000) = 1
[pid 29563] accept4(4, {sa_family=AF_INET, sin_port=htons(46566), sin_addr=inet_addr("127.0.0.1")}, [16], SOCK_CLOEXEC|SOCK_NONBLOCK) = 10
[pid 29563] epoll_ctl(9, EPOLL_CTL_ADD, 10, {EPOLLIN, {u32=10, u64=10}} <unfinished ...>
[pid 29565] <... epoll_wait resumed> [{EPOLLIN, {u32=10, u64=10}}], 4096, -1) = 1
[pid 29565] recvfrom(10, "POST / HTTP/1.1\r\nHost: 127.0.0.1"..., 8192, 0, NULL, NULL) = 149
[pid 29565] write(6, "\"\0\0\0\225\0\0\0\n\0\4\0POST / HTTP/1.1\r\nHos"..., 161) = 161
[pid 29565] epoll_wait(9,  <unfinished ...>
[pid 29563] <... epoll_ctl resumed> )   = 0
[pid 29563] accept4(4, 0x7fff6491f250, 0x7fff6491f248, SOCK_CLOEXEC|SOCK_NONBLOCK) = -1 EAGAIN (Resource temporarily unavailable)
[pid 29563] epoll_wait(7,  <unfinished ...>
[pid 29565] <... epoll_wait resumed> [{EPOLLIN, {u32=6, u64=21474836486}}], 4096, -1) = 1
[pid 29565] read(6, "\"\0\0\0\250\0\0\0\0\0\0\0HTTP/1.1 200 OK\r\nSer"..., 8192) = 180
[pid 29565] sendto(10, "HTTP/1.1 200 OK\r\nServer: swoole-"..., 168, 0, NULL, 0) = 168
[pid 29565] read(6, "\"\0\0\0\0\0\0\0\4@\0\0", 8192) = 12
[pid 29565] epoll_ctl(9, EPOLL_CTL_DEL, 10, NULL) = 0
[pid 29565] close(10)                   = 0
[pid 29565] read(6, 0x7f0dd2d6cd70, 8192) = -1 EAGAIN (Resource temporarily unavailable)
[pid 29565] epoll_wait(9,  <unfinished ...>
[pid 29563] <... epoll_wait resumed> [], 4096, 1000) = 0
[pid 29563] epoll_wait(7, [], 4096, 1000) = 0
[pid 29563] epoll_wait(7, [], 4096, 1000) = 0
[pid 29563] epoll_wait(7, [], 4096, 1000) = 0
...
```

**Comment by matyhtf** [comment]
感谢反馈，底层越界读取Content-Length导致。由于PHP的客户端分段发送头，触发底层BUG，解析出错误的Content-Length，请在Swoole前置Nginx。

**Comment by matyhtf** [comment]
已修复。
