### ISSUE TITLE
新版1.7.14 $server->reload 报错

### ISSUE THREAD

**Issue by yiliaofan** [swoole/swoole-src#226]
hi,
Warning: swoole_client::recv(): recv() failed. Error: Resource temporarily unavailable [11] in

之前版本1.7.9~1.7.13是没问题的，通过swoole_client发指令reload，有问题的tcpdump抓包如下：

15:09:20.182428 IP (tos 0x0, ttl 64, id 61960, offset 0, flags [DF], proto TCP (6), length 60)
    127.0.0.1.38866 > 127.0.0.1.8072: Flags [S], cksum 0x4ee0 (correct), seq 2652596113, win 32792, options [mss 16396,sack
OK,TS val 3993736601 ecr 0,nop,wscale 7], length 0
        0x0000:  4500 003c f208 4000 4006 4ab1 7f00 0001  E..<..@.@.J.....
        0x0010:  7f00 0001 97d2 1f88 9e1b 6791 0000 0000  ..........g.....
        0x0020:  a002 8018 4ee0 0000 0204 400c 0402 080a  ....N.....@.....
        0x0030:  ee0b 9599 0000 0000 0103 0307            ............
15:09:20.182463 IP (tos 0x0, ttl 64, id 0, offset 0, flags [DF], proto TCP (6), length 60)
    127.0.0.1.8072 > 127.0.0.1.38866: Flags [S.], cksum 0x6e7f (correct), seq 3282344221, ack 2652596114, win 32768, options [mss 16396,sackOK,TS val 3993736601 ecr 3993736601,nop,wscale 7], length 0
        0x0000:  4500 003c 0000 4000 4006 3cba 7f00 0001  E..<..@.@.<.....
        0x0010:  7f00 0001 1f88 97d2 c3a4 991d 9e1b 6792  ..............g.
        0x0020:  a012 8000 6e7f 0000 0204 400c 0402 080a  ....n.....@.....
        0x0030:  ee0b 9599 ee0b 9599 0103 0307            ............
15:09:20.182480 IP (tos 0x0, ttl 64, id 61961, offset 0, flags [DF], proto TCP (6), length 52)
    127.0.0.1.38866 > 127.0.0.1.8072: Flags [.], cksum 0x56a3 (correct), seq 1, ack 1, win 257, options [nop,nop,TS val 3993736601 ecr 3993736601], length 0
        0x0000:  4500 0034 f209 4000 4006 4ab8 7f00 0001  E..4..@.@.J.....
        0x0010:  7f00 0001 97d2 1f88 9e1b 6792 c3a4 991e  ..........g.....
        0x0020:  8010 0101 56a3 0000 0101 080a ee0b 9599  ....V...........
        0x0030:  ee0b 9599                                ....
15:09:20.183035 IP (tos 0x0, ttl 64, id 61962, offset 0, flags [DF], proto TCP (6), length 71)
    127.0.0.1.38866 > 127.0.0.1.8072: Flags [P.], cksum 0xfe3b (incorrect -> 0x4d4f), seq 1:20, ack 1, win 257, options [nop,nop,TS val 3993736602 ecr 3993736601], length 19
        0x0000:  4500 0047 f20a 4000 4006 4aa4 7f00 0001  E..G..@.@.J.....
        0x0010:  7f00 0001 97d2 1f88 9e1b 6792 c3a4 991e  ..........g.....
        0x0020:  8018 0101 fe3b 0000 0101 080a ee0b 959a  .....;..........
        0x0030:  ee0b 9599 252b 2d53 5365 7276 6572 252b  ....%+-SServer%+
        0x0040:  2d72 656c 6f61 64                        -reload
15:09:20.183050 IP (tos 0x0, ttl 64, id 3207, offset 0, flags [DF], proto TCP (6), length 52)
    127.0.0.1.8072 > 127.0.0.1.38866: Flags [.], cksum 0x568f (correct), seq 1, ack 20, win 256, options [nop,nop,TS val 3993736602 ecr 3993736602], length 0
        0x0000:  4500 0034 0c87 4000 4006 303b 7f00 0001  E..4..@.@.0;....
        0x0010:  7f00 0001 1f88 97d2 c3a4 991e 9e1b 67a5  ..............g.
        0x0020:  8010 0100 568f 0000 0101 080a ee0b 959a  ....V...........
        0x0030:  ee0b 959a                                ....
15:09:20.686310 IP (tos 0x0, ttl 64, id 61963, offset 0, flags [DF], proto TCP (6), length 52)
    127.0.0.1.38866 > 127.0.0.1.8072: Flags [F.], cksum 0x5496 (correct), seq 20, ack 1, win 257, options [nop,nop,TS val 3993737105 ecr 3993736602], length 0
        0x0000:  4500 0034 f20b 4000 4006 4ab6 7f00 0001  E..4..@.@.J.....
        0x0010:  7f00 0001 97d2 1f88 9e1b 67a5 c3a4 991e  ..........g.....
        0x0020:  8011 0101 5496 0000 0101 080a ee0b 9791  ....T...........
        0x0030:  ee0b 959a                                ....
15:09:20.692175 IP (tos 0x0, ttl 64, id 3208, offset 0, flags [DF], proto TCP (6), length 52)
    127.0.0.1.8072 > 127.0.0.1.38866: Flags [F.], cksum 0x5299 (correct), seq 1, ack 21, win 256, options [nop,nop,TS val 3993737111 ecr 3993737105], length 0
        0x0000:  4500 0034 0c88 4000 4006 303a 7f00 0001  E..4..@.@.0:....
        0x0010:  7f00 0001 1f88 97d2 c3a4 991e 9e1b 67a6  ..............g.
        0x0020:  8011 0100 5299 0000 0101 080a ee0b 9797  ....R...........
        0x0030:  ee0b 9791                                ....
15:09:20.692222 IP (tos 0x0, ttl 64, id 61964, offset 0, flags [DF], proto TCP (6), length 52)
    127.0.0.1.38866 > 127.0.0.1.8072: Flags [.], cksum 0x5292 (correct), seq 21, ack 2, win 257, options [nop,nop,TS val 3993737111 ecr 3993737111], length 0
        0x0000:  4500 0034 f20c 4000 4006 4ab5 7f00 0001  E..4..@.@.J.....
        0x0010:  7f00 0001 97d2 1f88 9e1b 67a6 c3a4 991f  ..........g.....
        0x0020:  8010 0101 5292 0000 0101 080a ee0b 9797  ....R...........
        0x0030:  ee0b 9797                                ....

**Comment by matyhtf** [comment]
reload有什么问题？是否用了BASE模式。

**Comment by yiliaofan** [comment]
SWOOLE_PROCESS 模式的

尝试下1.7.15-alpha 最新版本，还有此问题，有点诡异，不知是否我使用的问题：

Warning: swoole_client::recv(): recv() failed. Error: Resource temporarily unavailable [11] in  libs/Swoole/Server/Server.php on line 555

552        $socket = new \swoole_client($this->sockType, SWOOLE_SOCK_SYNC);
553        $socket->connect($this->host, $this->port);
554        $socket->send($this->preSysCmd .  "reload");
555        $ret = $socket->recv();

**Comment by yiliaofan** [comment]
已确认是我这边的问题，原因：
$ret = intval($server->reload());
 $server->send($fd, ret);

有提示错误：
swoole_server::send(): only supports string or swoole_buffer type.

帮忙close下这个issue，打扰了 ，非常感谢～

**Comment by matyhtf** [comment]
会更新的
