### ISSUE TITLE
swoole pong 回应的数据错误？

### ISSUE THREAD

**Issue by wqmeng** [swoole/swoole-src#1414]
swoole 2.0.10 版本，

客户端主动发送 ping 数据， 数据为以时间戳创建的一个字符串。  按websocket的协议，服务端应该是 把这个字符串原样返回吧， 但是通过测试发现  swoole_websocket_server 返回的 Pong 数据， 在字符串的前面加上了 Masking-Key，导致客户端认为收到了错误的pong数据而主动关闭websocket连接。 

这个是不是因为没有严格遵守协议的问题？ 

其中的案例
Frame 277: 77 bytes on wire (616 bits), 77 bytes captured (616 bits) on interface 0

Transmission Control Protocol, Src Port: 11972, Dst Port: 9501, Seq: 171, Ack: 204, Len: 23
WebSocket
    1... .... = Fin: True
    .000 .... = Reserved: 0x0
    .... 1001 = Opcode: Ping (9)
    1... .... = Mask: True
    .001 0001 = Payload length: 17
    Masking-Key: 3fad8b72
    Masked payload
    Payload
        Ping: 3230313731323133303232353535373837

		
		
Frame 283: 77 bytes on wire (616 bits), 77 bytes captured (616 bits) on interface 0

Transmission Control Protocol, Src Port: 9501, Dst Port: 11972, Seq: 204, Ack: 194, Len: 23
WebSocket
    1... .... = Fin: True
    .000 .... = Reserved: 0x0
    .... 1010 = Opcode: Pong (10)
    0... .... = Mask: False
    .001 0101 = Payload length: 21
    Payload
        Pong: **3fad8b72**3230313731323133303232353535373837

请测试是否有这样的问题。

**Comment by wqmeng** [comment]
今天测试由服务端自动ping客户端， 好像直接就断掉了。 用 wireshark 抓包， 服务端好像发来的不是 websocket 数据包， 无法正常解析，是不是服务端发送的ping包，格式不对？

**Comment by matyhtf** [comment]
客户端使用什么软件？

**Comment by matyhtf** [comment]
已修复。客户端发送`PING`帧如果有`MASK`会导致服务器`PONG`帧出现错误。
