### ISSUE TITLE
Swoole\Coroutine\FastCGI\Client设置了withKeepConn为true仍然无法复用同一个连接

### ISSUE THREAD

**Issue by mrxiaojie** [swoole/swoole-src#5257]
Please answer these questions before submitting your issue.

1. What did you do? If possible, provide a simple script for reproducing the error.
```<?php
use function Swoole\Coroutine\run;

run(function (){
    $client = new \Swoole\Coroutine\FastCGI\Client('127.0.0.1', 9000);
    $f = "/home/php/index.php";
    try {
        $request = (new \Swoole\FastCGI\HttpRequest())
            ->withScriptFilename($f)
            ->withMethod('POST')
            ->withKeepConn(true)
            ->withBody(['who' => 'Swoole']);
        $response = $client->execute($request);
        echo "Result1: {$response->getBody()}\n";

        co::sleep(30);
    } catch (\Swoole\Coroutine\FastCGI\Client\Exception $exception) {
        echo "Error1: {$exception->getMessage()}\n";
    }

    try {
        $request = (new \Swoole\FastCGI\HttpRequest())
            ->withScriptFilename($f)
            ->withMethod('POST')
            ->withKeepConn(true)
            ->withBody(['who' => 'Swoole']);
        $response = $client->execute($request);
        echo "Result2: {$response->getBody()}\n";

    } catch (\Swoole\Coroutine\FastCGI\Client\Exception $exception) {
        echo "Error2: {$exception->getMessage()}\n";
    }

    co::sleep(600);
});
```
Result1: {"response_status":{"error":"no action avaliable, exit","code":301,"report_code":-1,"t_id":"a3588a0c87c1d19d306f3d3a397bb85e"}}

Error2: Connection reset by peer
使用同一个连接再次发起数据就会出现连接被重置，无法复用该连接。

2. What did you expect to see?

查看Swoole\FastCGI\Request类，若设置了withKeepConn(true)是会在发送fastcgi协议格式数据头设置FastCGI::KEEP_CONN，同样的设置使用golang来实现，在与php-fpm的同一个连接中可以多次发送数据，并且常驻进程与php-fpm的连接维持长连接不断开

3. What did you see instead?
tcpdump：
```
07:44:33.763319 IP localhost.54502 > localhost.9000: Flags [S], seq 2569639256, win 65495, options [mss 65495,sackOK,TS val 859272357 ecr 0,nop,wscale 7], length 0
07:44:33.763335 IP localhost.9000 > localhost.54502: Flags [S.], seq 1722153661, ack 2569639257, win 65483, options [mss 65495,sackOK,TS val 859272357 ecr 859272357,nop,wscale 7], length 0
07:44:33.763349 IP localhost.54502 > localhost.9000: Flags [.], ack 1, win 512, options [nop,nop,TS val 859272357 ecr 859272357], length 0
07:44:33.763579 IP localhost.54502 > localhost.9000: Flags [P.], seq 1:482, ack 1, win 512, options [nop,nop,TS val 859272358 ecr 859272357], length 481
07:44:33.763611 IP localhost.9000 > localhost.54502: Flags [.], ack 482, win 508, options [nop,nop,TS val 859272358 ecr 859272358], length 0
07:44:33.798436 IP localhost.9000 > localhost.54502: Flags [P.], seq 1:225, ack 482, win 508, options [nop,nop,TS val 859272393 ecr 859272358], length 224
07:44:33.798460 IP localhost.54502 > localhost.9000: Flags [.], ack 225, win 511, options [nop,nop,TS val 859272393 ecr 859272393], length 0
07:45:03.829185 IP localhost.54502 > localhost.9000: Flags [P.], seq 482:963, ack 225, win 512, options [nop,nop,TS val 859302423 ecr 859272393], length 481
07:45:03.829213 IP localhost.9000 > localhost.54502: Flags [.], ack 963, win 506, options [nop,nop,TS val 859302423 ecr 859302423], length 0
07:45:03.829271 IP localhost.9000 > localhost.54502: Flags [R.], seq 225, ack 963, win 512, options [nop,nop,TS val 859302424 ecr 859302423], length 0
```

4. What version of Swoole are you using (show your `php --ri swoole`)?
```
swoole

Swoole => enabled
Author => Swoole Team <team@swoole.com>
Version => 4.8.13
Built => Jan 26 2024 11:40:11
coroutine => enabled with boost asm context
epoll => enabled
eventfd => enabled
signalfd => enabled
spinlock => enabled
rwlock => enabled
zlib => 1.2.12
mutex_timedlock => enabled
pthread_barrier => enabled
async_redis => enabled

Directive => Local Value => Master Value
swoole.enable_coroutine => On => On
swoole.enable_library => On => On
swoole.enable_preemptive_scheduler => Off => Off
swoole.display_errors => On => On
swoole.use_shortname => On => On
swoole.unixsock_buffer_size => 8388608 => 8388608
/home/17sing/joyparty_dev.1.5.1/php/rpc # 
```

5. What is your machine environment used (show your `uname -a` & `php -v` & `gcc -v`) ?
docker 环境
```
Linux 860d10d3b11f 5.10.16.3-microsoft-standard-WSL2 #1 SMP Fri Apr 2 22:23:49 UTC 2021 x86_64 Linux

PHP 7.4.16 (cli) (built: Apr 15 2021 00:56:09) ( NTS )
Copyright (c) The PHP Group
Zend Engine v3.4.0, Copyright (c) Zend Technologies
with Zend OPcache v7.4.16, Copyright (c), by Zend Technologies

```

**Comment by NathanFreeman** [comment]
看了报文，好像没把这个发出去，我看看是怎么回事

**Comment by mrxiaojie** [comment]
下午好！您的邮件我已经收到了，谢谢您的支持！

**Comment by mrxiaojie** [comment]
问题已经找到了，swoole_library/src/core/FastCGI/Request.php  的第 30,43行最后多了一个 "}",导致php-fpm解析协议数据包异常
![image](https://github.com/swoole/swoole-src/assets/10007138/be3ea3e8-1044-486b-a117-78dc6c5feca3)
去除这两个多余符号就可以正常了
![image](https://github.com/swoole/swoole-src/assets/10007138/eb90db63-d182-4b1a-8b1d-5a9875c89691)

**Comment by mrxiaojie** [comment]
有空的时候麻烦线上版本修改一下这个问题哈

**Comment by deminy** [comment]
MR swoole/library#169 has been merged.
