### ISSUE TITLE
Swoole\Client close() 返回true 但是没有关闭连接

### ISSUE THREAD

**Issue by wenjy** [swoole/swoole-src#2761]
Please answer these questions before submitting your issue. Thanks!

1. What did you do? If possible, provide a simple script for reproducing the error.

```

<?php

use Swoole\Client;

$client = new Client(SWOOLE_SOCK_TCP, SWOOLE_SOCK_ASYNC);

        $client->on('connect', function (Client $cli) {

            $cli->send('aaaa');
        }); 

        $client->on('receive',function (Client $cli, $data) {

            var_dump($data);
            $cli->close();
        }); 

        $client->on('error', function (Client $cli) {
            echo 'fail Connection error' . PHP_EOL;
        }); 

        $client->on('close', function (Client $cli) {

        }); 

        $client->connect('127.0.0.1', 9501);

```

2. What did you expect to see?

 调用 $cli->close(); 客户端并没有关闭

3. What did you see instead?

4. What version of Swoole are you using (show your `php --ri swoole`)?

4.4.3

5. What is your machine environment used (including version of kernel & php & gcc) ?

**Comment by matyhtf** [comment]
请使用 strace 和 tcpdump 跟踪

**Comment by wenjy** [comment]
strace

```
31389 epoll_wait(20,  <unfinished ...>
31388 epoll_wait(19,  <unfinished ...>
31386 restart_syscall(<... resuming interrupted futex ...> <unfinished ...>
31385 futex(0x33122ac, FUTEX_WAIT_PRIVATE, 1, NULL <unfinished ...>
31384 futex(0x3311a1c, FUTEX_WAIT_PRIVATE, 1, NULL <unfinished ...>
31383 stat("/etc/localtime", {st_mode=S_IFREG|0644, st_size=388, ...}) = 0
31383 write(1, "[2019-08-19 10:43:03 #31383.2]\tT"..., 88) = 88
31383 epoll_wait(17, [], 4096, 502)     = 0
31383 stat("/etc/localtime", {st_mode=S_IFREG|0644, st_size=388, ...}) = 0
31383 write(1, "[2019-08-19 10:43:03 #31383.2]\tT"..., 88) = 88
31383 stat("/etc/localtime", {st_mode=S_IFREG|0644, st_size=388, ...}) = 0
31383 write(1, "[2019-08-19 10:43:03 #31383.2]\tT"..., 100) = 100
31383 epoll_wait(17,  <unfinished ...>
31386 <... restart_syscall resumed> )   = -1 ETIMEDOUT (Connection timed out)
31386 futex(0x7f94a8aa6d20, FUTEX_WAKE_PRIVATE, 1) = 0
31386 futex(0x7f94a8aa6ce4, FUTEX_WAIT_BITSET_PRIVATE, 1939, {938174, 938847896}, ffffffff <unfinished ...>
31383 <... epoll_wait resumed> [], 4096, 1000) = 0
31383 stat("/etc/localtime", {st_mode=S_IFREG|0644, st_size=388, ...}) = 0
31383 write(1, "[2019-08-19 10:43:04 #31383.2]\tT"..., 88) = 88
31383 stat("/etc/localtime", {st_mode=S_IFREG|0644, st_size=388, ...}) = 0
31383 write(1, "[2019-08-19 10:43:04 #31383.2]\tT"..., 100) = 100
31383 epoll_wait(17,  <unfinished ...>
31386 <... futex resumed> )             = -1 ETIMEDOUT (Connection timed out)
31386 futex(0x7f94a8aa6d20, FUTEX_WAKE_PRIVATE, 1) = 0
31386 futex(0x7f94a8aa6ce4, FUTEX_WAIT_BITSET_PRIVATE, 1941, {938175, 938847896}, ffffffff <unfinished ...>
31383 <... epoll_wait resumed> [], 4096, 998) = 0
31383 stat("/etc/localtime", {st_mode=S_IFREG|0644, st_size=388, ...}) = 0
31383 write(1, "[2019-08-19 10:43:05 #31383.2]\tT"..., 88) = 88
31383 stat("/etc/localtime", {st_mode=S_IFREG|0644, st_size=388, ...}) = 0
31383 write(1, "[2019-08-19 10:43:05 #31383.2]\tT"..., 100) = 100
31383 epoll_wait(17,  <unfinished ...>
31386 <... futex resumed> )             = -1 ETIMEDOUT (Connection timed out)
31386 futex(0x7f94a8aa6d20, FUTEX_WAKE_PRIVATE, 1) = 0
31386 futex(0x7f94a8aa6ce4, FUTEX_WAIT_BITSET_PRIVATE, 1943, {938176, 938847896}, ffffffff <unfinished ...>
31383 <... epoll_wait resumed> [], 4096, 999) = 0
31383 stat("/etc/localtime", {st_mode=S_IFREG|0644, st_size=388, ...}) = 0
31383 write(1, "[2019-08-19 10:43:06 #31383.2]\tT"..., 88) = 88
31383 stat("/etc/localtime", {st_mode=S_IFREG|0644, st_size=388, ...}) = 0
31383 write(1, "[2019-08-19 10:43:06 #31383.2]\tT"..., 100) = 100
31383 epoll_wait(17,  <unfinished ...>
31386 <... futex resumed> )             = -1 ETIMEDOUT (Connection timed out)
31386 futex(0x7f94a8aa6d20, FUTEX_WAKE_PRIVATE, 1) = 0
31386 futex(0x7f94a8aa6ce4, FUTEX_WAIT_BITSET_PRIVATE, 1945, {938177, 938847896}, ffffffff <unfinished ...>
31383 <... epoll_wait resumed> [], 4096, 998) = 0
31383 stat("/etc/localtime", {st_mode=S_IFREG|0644, st_size=388, ...}) = 0
31383 write(1, "[2019-08-19 10:43:07 #31383.2]\tT"..., 88) = 88
31383 stat("/etc/localtime", {st_mode=S_IFREG|0644, st_size=388, ...}) = 0
31383 write(1, "[2019-08-19 10:43:07 #31383.2]\tT"..., 100) = 100
31383 epoll_wait(17,  <unfinished ...>
31386 <... futex resumed> )             = -1 ETIMEDOUT (Connection timed out)
31386 futex(0x7f94a8aa6d20, FUTEX_WAKE_PRIVATE, 1) = 0
31386 futex(0x7f94a8aa6ce4, FUTEX_WAIT_BITSET_PRIVATE, 1947, {938178, 938847896}, ffffffff <unfinished ...>
31383 <... epoll_wait resumed> [{EPOLLIN, {u32=4, u64=4294967300}}], 4096, 999) = 1
31383 accept4(4, {sa_family=AF_INET, sin_port=htons(24750), sin_addr=inet_addr("127.0.0.1")}, [16], SOCK_CLOEXEC|SOCK_NONBLOCK) = 21
31383 stat("/etc/localtime", {st_mode=S_IFREG|0644, st_size=388, ...}) = 0
31383 write(1, "[2019-08-19 10:43:08 #31383.2]\tT"..., 130) = 130
31383 setsockopt(21, SOL_TCP, TCP_NODELAY, [1], 4) = 0
31383 epoll_ctl(20, EPOLL_CTL_ADD, 21, {EPOLLOUT, {u32=21, u64=21}} <unfinished ...>
31389 <... epoll_wait resumed> [{EPOLLOUT, {u32=21, u64=21}}], 4096, -1) = 1
31383 <... epoll_ctl resumed> )         = 0
31389 futex(0x7f94b37e5ec0, FUTEX_WAIT_PRIVATE, 2, NULL <unfinished ...>
31383 stat("/etc/localtime", {st_mode=S_IFREG|0644, st_size=388, ...}) = 0
31383 futex(0x7f94b37e5ec0, FUTEX_WAKE_PRIVATE, 1 <unfinished ...>
31389 <... futex resumed> )             = 0
31383 <... futex resumed> )             = 1
31389 stat("/etc/localtime",  <unfinished ...>
31383 write(1, "[2019-08-19 10:43:08 #31383.2]\tT"..., 107 <unfinished ...>
31389 <... stat resumed> {st_mode=S_IFREG|0644, st_size=388, ...}) = 0
31383 <... write resumed> )             = 107
31389 futex(0x7f94b37e5ec0, FUTEX_WAKE_PRIVATE, 1 <unfinished ...>
31383 accept4(4,  <unfinished ...>
31389 <... futex resumed> )             = 0
31383 <... accept4 resumed> 0x7fffb4e3ea50, 0x7fffb4e3eac0, SOCK_CLOEXEC|SOCK_NONBLOCK) = -1 EAGAIN (Resource temporarily unavailable)
31389 write(1, "[2019-08-19 10:43:08 #31383.1]\tT"..., 165 <unfinished ...>
31383 stat("/etc/localtime",  <unfinished ...>
31389 <... write resumed> )             = 165
31383 <... stat resumed> {st_mode=S_IFREG|0644, st_size=388, ...}) = 0
31389 write(12, "\4\0\0\0\0\0\0\0\1\0\5\0\4\0\0\0", 16 <unfinished ...>
31383 write(1, "[2019-08-19 10:43:08 #31383.2]\tT"..., 88 <unfinished ...>
31389 <... write resumed> )             = 16
31383 <... write resumed> )             = 88
31389 epoll_ctl(20, EPOLL_CTL_MOD, 21, {EPOLLIN, {u32=21, u64=21}} <unfinished ...>
31383 epoll_wait(17,  <unfinished ...>
31389 <... epoll_ctl resumed> )         = 0
31389 stat("/etc/localtime", {st_mode=S_IFREG|0644, st_size=388, ...}) = 0
31389 write(1, "[2019-08-19 10:43:08 #31383.1]\tT"..., 106) = 106
31389 epoll_wait(20, [{EPOLLIN, {u32=21, u64=21}}], 4096, -1) = 1
31389 recvfrom(21, "aaaa", 65536, 0, NULL, NULL) = 4
31389 stat("/etc/localtime", {st_mode=S_IFREG|0644, st_size=388, ...}) = 0
31389 write(1, "[2019-08-19 10:43:08 #31383.1]\tT"..., 90) = 90
31389 stat("/etc/localtime", {st_mode=S_IFREG|0644, st_size=388, ...}) = 0
31389 write(1, "[2019-08-19 10:43:08 #31383.1]\tT"..., 104) = 104
31389 write(12, "\4\0\0\0\4\0\0\0\1\0\0\0\4\0\0\0aaaa", 20) = 20
31389 epoll_wait(20, [{EPOLLIN, {u32=12, u64=21474836492}}], 4096, -1) = 1
31389 read(12, "\4\0\0\0\f\0\0\0\1\0\0\0\1\0\0\0Server: aaaa", 425952) = 28
31389 sendto(21, "Server: aaaa", 12, 0, NULL, 0) = 12
31389 stat("/etc/localtime", {st_mode=S_IFREG|0644, st_size=388, ...}) = 0
31389 write(1, "[2019-08-19 10:43:08 #31383.1]\tT"..., 88) = 88
31389 read(12, 0x7f949dc81010, 425952)  = -1 EAGAIN (Resource temporarily unavailable)
31389 epoll_wait(20,  <unfinished ...>
31383 <... epoll_wait resumed> [], 4096, 317) = 0
31383 stat("/etc/localtime", {st_mode=S_IFREG|0644, st_size=388, ...}) = 0
31383 write(1, "[2019-08-19 10:43:08 #31383.2]\tT"..., 88) = 88
31383 stat("/etc/localtime", {st_mode=S_IFREG|0644, st_size=388, ...}) = 0
31383 write(1, "[2019-08-19 10:43:08 #31383.2]\tT"..., 100) = 100
31383 epoll_wait(17,  <unfinished ...>
31386 <... futex resumed> )             = -1 ETIMEDOUT (Connection timed out)
31386 futex(0x7f94a8aa6d20, FUTEX_WAKE_PRIVATE, 1) = 0
31386 futex(0x7f94a8aa6ce4, FUTEX_WAIT_BITSET_PRIVATE, 1949, {938179, 938847896}, ffffffff <unfinished ...>
31383 <... epoll_wait resumed> [], 4096, 1000) = 0
31383 stat("/etc/localtime", {st_mode=S_IFREG|0644, st_size=388, ...}) = 0
31383 write(1, "[2019-08-19 10:43:09 #31383.2]\tT"..., 88) = 88
31383 stat("/etc/localtime", {st_mode=S_IFREG|0644, st_size=388, ...}) = 0
31383 write(1, "[2019-08-19 10:43:09 #31383.2]\tT"..., 100) = 100
31383 epoll_wait(17,  <unfinished ...>
31386 <... futex resumed> )             = -1 ETIMEDOUT (Connection timed out)
31386 futex(0x7f94a8aa6d20, FUTEX_WAKE_PRIVATE, 1) = 0
31386 futex(0x7f94a8aa6ce4, FUTEX_WAIT_BITSET_PRIVATE, 1951, {938180, 938847896}, ffffffff <unfinished ...>
31383 <... epoll_wait resumed> [], 4096, 999) = 0
31383 stat("/etc/localtime", {st_mode=S_IFREG|0644, st_size=388, ...}) = 0
31383 write(1, "[2019-08-19 10:43:10 #31383.2]\tT"..., 88) = 88
31383 stat("/etc/localtime", {st_mode=S_IFREG|0644, st_size=388, ...}) = 0
31383 write(1, "[2019-08-19 10:43:10 #31383.2]\tT"..., 100) = 100
31383 epoll_wait(17,  <unfinished ...>
31386 <... futex resumed> )             = -1 ETIMEDOUT (Connection timed out)
31386 futex(0x7f94a8aa6d20, FUTEX_WAKE_PRIVATE, 1) = 0
31386 futex(0x7f94a8aa6ce4, FUTEX_WAIT_BITSET_PRIVATE, 1953, {938181, 938847896}, ffffffff <unfinished ...>
31383 <... epoll_wait resumed> [], 4096, 999) = 0
31383 stat("/etc/localtime", {st_mode=S_IFREG|0644, st_size=388, ...}) = 0
31383 write(1, "[2019-08-19 10:43:11 #31383.2]\tT"..., 88) = 88
31383 stat("/etc/localtime", {st_mode=S_IFREG|0644, st_size=388, ...}) = 0
31383 write(1, "[2019-08-19 10:43:11 #31383.2]\tT"..., 100) = 100
31383 epoll_wait(17,  <unfinished ...>
31386 <... futex resumed> )             = -1 ETIMEDOUT (Connection timed out)
31386 futex(0x7f94a8aa6d20, FUTEX_WAKE_PRIVATE, 1) = 0
31386 futex(0x7f94a8aa6ce4, FUTEX_WAIT_BITSET_PRIVATE, 1955, {938182, 938847896}, ffffffff <unfinished ...>
31383 <... epoll_wait resumed> [], 4096, 998) = 0
31383 stat("/etc/localtime", {st_mode=S_IFREG|0644, st_size=388, ...}) = 0
31383 write(1, "[2019-08-19 10:43:12 #31383.2]\tT"..., 88) = 88
31383 stat("/etc/localtime", {st_mode=S_IFREG|0644, st_size=388, ...}) = 0
31383 write(1, "[2019-08-19 10:43:12 #31383.2]\tT"..., 100) = 100
31383 epoll_wait(17,  <unfinished ...>
31386 <... futex resumed> )             = -1 ETIMEDOUT (Connection timed out)
31386 futex(0x7f94a8aa6d20, FUTEX_WAKE_PRIVATE, 1) = 0
31386 futex(0x7f94a8aa6ce4, FUTEX_WAIT_BITSET_PRIVATE, 1957, {938183, 938847896}, ffffffff <unfinished ...>
31383 <... epoll_wait resumed> [], 4096, 999) = 0
31383 stat("/etc/localtime", {st_mode=S_IFREG|0644, st_size=388, ...}) = 0
31383 write(1, "[2019-08-19 10:43:13 #31383.2]\tT"..., 88) = 88
31383 stat("/etc/localtime", {st_mode=S_IFREG|0644, st_size=388, ...}) = 0
31383 write(1, "[2019-08-19 10:43:13 #31383.2]\tT"..., 100) = 100
31383 epoll_wait(17,  <unfinished ...>
31386 <... futex resumed> )             = -1 ETIMEDOUT (Connection timed out)
31386 futex(0x7f94a8aa6d20, FUTEX_WAKE_PRIVATE, 1) = 0
31386 futex(0x7f94a8aa6ce4, FUTEX_WAIT_BITSET_PRIVATE, 1959, {938184, 938847896}, ffffffff <unfinished ...>
31383 <... epoll_wait resumed> [], 4096, 998) = 0
31383 stat("/etc/localtime", {st_mode=S_IFREG|0644, st_size=388, ...}) = 0
31383 write(1, "[2019-08-19 10:43:14 #31383.2]\tT"..., 88) = 88
31383 stat("/etc/localtime", {st_mode=S_IFREG|0644, st_size=388, ...}) = 0
31383 write(1, "[2019-08-19 10:43:14 #31383.2]\tT"..., 100) = 100
31383 epoll_wait(17,  <unfinished ...>
31386 <... futex resumed> )             = -1 ETIMEDOUT (Connection timed out)
31386 futex(0x7f94a8aa6d20, FUTEX_WAKE_PRIVATE, 1) = 0
31386 futex(0x7f94a8aa6ce4, FUTEX_WAIT_BITSET_PRIVATE, 1961, {938185, 938847896}, ffffffff <unfinished ...>
31383 <... epoll_wait resumed> [], 4096, 998) = 0
31383 stat("/etc/localtime", {st_mode=S_IFREG|0644, st_size=388, ...}) = 0
31383 write(1, "[2019-08-19 10:43:15 #31383.2]\tT"..., 88) = 88
31383 stat("/etc/localtime", {st_mode=S_IFREG|0644, st_size=388, ...}) = 0
31383 write(1, "[2019-08-19 10:43:15 #31383.2]\tT"..., 100) = 100
31383 epoll_wait(17,  <unfinished ...>
31386 <... futex resumed> )             = -1 ETIMEDOUT (Connection timed out)
31386 futex(0x7f94a8aa6d20, FUTEX_WAKE_PRIVATE, 1) = 0
31386 futex(0x7f94a8aa6ce4, FUTEX_WAIT_BITSET_PRIVATE, 1963, {938186, 938847896}, ffffffff <unfinished ...>
31383 <... epoll_wait resumed> [], 4096, 999) = 0
31383 stat("/etc/localtime", {st_mode=S_IFREG|0644, st_size=388, ...}) = 0
31383 write(1, "[2019-08-19 10:43:16 #31383.2]\tT"..., 88) = 88
31383 stat("/etc/localtime", {st_mode=S_IFREG|0644, st_size=388, ...}) = 0
31383 write(1, "[2019-08-19 10:43:16 #31383.2]\tT"..., 100) = 100
31383 epoll_wait(17,  <unfinished ...>
31386 <... futex resumed> )             = -1 ETIMEDOUT (Connection timed out)
31386 futex(0x7f94a8aa6d20, FUTEX_WAKE_PRIVATE, 1) = 0
31386 futex(0x7f94a8aa6ce4, FUTEX_WAIT_BITSET_PRIVATE, 1965, {938187, 938847896}, ffffffff <unfinished ...>
31383 <... epoll_wait resumed> [], 4096, 998) = 0
31383 stat("/etc/localtime", {st_mode=S_IFREG|0644, st_size=388, ...}) = 0
31383 write(1, "[2019-08-19 10:43:17 #31383.2]\tT"..., 88) = 88
31383 stat("/etc/localtime", {st_mode=S_IFREG|0644, st_size=388, ...}) = 0
31383 write(1, "[2019-08-19 10:43:17 #31383.2]\tT"..., 100) = 100
31383 epoll_wait(17,  <unfinished ...>
31386 <... futex resumed> )             = -1 ETIMEDOUT (Connection timed out)
31386 futex(0x7f94a8aa6d20, FUTEX_WAKE_PRIVATE, 1) = 0
31386 futex(0x7f94a8aa6ce4, FUTEX_WAIT_BITSET_PRIVATE, 1967, {938188, 938847896}, ffffffff <unfinished ...>
31383 <... epoll_wait resumed> [], 4096, 999) = 0
31383 stat("/etc/localtime", {st_mode=S_IFREG|0644, st_size=388, ...}) = 0
31383 write(1, "[2019-08-19 10:43:18 #31383.2]\tT"..., 88) = 88
31383 stat("/etc/localtime", {st_mode=S_IFREG|0644, st_size=388, ...}) = 0
31383 write(1, "[2019-08-19 10:43:18 #31383.2]\tT"..., 100) = 100
31383 epoll_wait(17,  <unfinished ...>
31386 <... futex resumed> )             = -1 ETIMEDOUT (Connection timed out)
31386 futex(0x7f94a8aa6d20, FUTEX_WAKE_PRIVATE, 1) = 0
31386 futex(0x7f94a8aa6ce4, FUTEX_WAIT_BITSET_PRIVATE, 1969, {938189, 938847896}, ffffffff <unfinished ...>
31383 <... epoll_wait resumed> [], 4096, 998) = 0
31383 stat("/etc/localtime", {st_mode=S_IFREG|0644, st_size=388, ...}) = 0
31383 write(1, "[2019-08-19 10:43:19 #31383.2]\tT"..., 88) = 88
31383 stat("/etc/localtime", {st_mode=S_IFREG|0644, st_size=388, ...}) = 0
31383 write(1, "[2019-08-19 10:43:19 #31383.2]\tT"..., 100) = 100
31383 epoll_wait(17,  <unfinished ...>
31386 <... futex resumed> )             = -1 ETIMEDOUT (Connection timed out)
31386 futex(0x7f94a8aa6d20, FUTEX_WAKE_PRIVATE, 1) = 0

```

tcpdump

```
tcpdump: verbose output suppressed, use -v or -vv for full protocol decode
listening on any, link-type LINUX_SLL (Linux cooked), capture size 262144 bytes
10:43:08.362381 IP 127.0.0.1.24750 > 127.0.0.1.9501: Flags [S], seq 2121846785, win 43690, options [mss 65495,sackOK,TS val 937878599 ecr 0,nop,wscale 7], length 0
	0x0000:  4500 003c 3446 4000 4006 0874 7f00 0001  E..<4F@.@..t....
	0x0010:  7f00 0001 60ae 251d 7e78 d001 0000 0000  ....`.%.~x......
	0x0020:  a002 aaaa fe30 0000 0204 ffd7 0402 080a  .....0..........
	0x0030:  37e6 e447 0000 0000 0103 0307 0000 0000  7..G............
	0x0040:  0000 0000 0000 0000 0000 0000            ............
10:43:08.362398 IP 127.0.0.1.9501 > 127.0.0.1.24750: Flags [S.], seq 3359562143, ack 2121846786, win 43690, options [mss 65495,sackOK,TS val 937878599 ecr 937878599,nop,wscale 7], length 0
	0x0000:  4500 003c 0000 4000 4006 3cba 7f00 0001  E..<..@.@.<.....
	0x0010:  7f00 0001 251d 60ae c83e d99f 7e78 d002  ....%.`..>..~x..
	0x0020:  a012 aaaa fe30 0000 0204 ffd7 0402 080a  .....0..........
	0x0030:  37e6 e447 37e6 e447 0103 0307 0000 0000  7..G7..G........
	0x0040:  0000 0000 0000 0000 0000 0000            ............
10:43:08.362407 IP 127.0.0.1.24750 > 127.0.0.1.9501: Flags [.], ack 1, win 342, options [nop,nop,TS val 937878599 ecr 937878599], length 0
	0x0000:  4500 0034 3447 4000 4006 087b 7f00 0001  E..44G@.@..{....
	0x0010:  7f00 0001 60ae 251d 7e78 d002 c83e d9a0  ....`.%.~x...>..
	0x0020:  8010 0156 fe28 0000 0101 080a 37e6 e447  ...V.(......7..G
	0x0030:  37e6 e447 0000 0000 0000 0000 0000 0000  7..G............
	0x0040:  0000 0000                                ....
10:43:08.362605 IP 127.0.0.1.24750 > 127.0.0.1.9501: Flags [P.], seq 1:5, ack 1, win 342, options [nop,nop,TS val 937878599 ecr 937878599], length 4
	0x0000:  4500 0038 3448 4000 4006 0876 7f00 0001  E..84H@.@..v....
	0x0010:  7f00 0001 60ae 251d 7e78 d002 c83e d9a0  ....`.%.~x...>..
	0x0020:  8018 0156 fe2c 0000 0101 080a 37e6 e447  ...V.,......7..G
	0x0030:  37e6 e447 6161 6161 0000 0000 0000 0000  7..Gaaaa........
	0x0040:  0000 0000 0000 0000                      ........
10:43:08.362618 IP 127.0.0.1.9501 > 127.0.0.1.24750: Flags [.], ack 5, win 342, options [nop,nop,TS val 937878599 ecr 937878599], length 0
	0x0000:  4500 0034 3de7 4000 4006 feda 7f00 0001  E..4=.@.@.......
	0x0010:  7f00 0001 251d 60ae c83e d9a0 7e78 d006  ....%.`..>..~x..
	0x0020:  8010 0156 fe28 0000 0101 080a 37e6 e447  ...V.(......7..G
	0x0030:  37e6 e447 0000 0000 0000 0000 0000 0000  7..G............
	0x0040:  0000 0000                                ....
10:43:08.364912 IP 127.0.0.1.9501 > 127.0.0.1.24750: Flags [P.], seq 1:13, ack 5, win 342, options [nop,nop,TS val 937878601 ecr 937878599], length 12
	0x0000:  4500 0040 3de8 4000 4006 fecd 7f00 0001  E..@=.@.@.......
	0x0010:  7f00 0001 251d 60ae c83e d9a0 7e78 d006  ....%.`..>..~x..
	0x0020:  8018 0156 fe34 0000 0101 080a 37e6 e449  ...V.4......7..I
	0x0030:  37e6 e447 5365 7276 6572 3a20 6161 6161  7..GServer:.aaaa
	0x0040:  0000 0000 0000 0000 0000 0000 0000 0000  ................
10:43:08.364921 IP 127.0.0.1.24750 > 127.0.0.1.9501: Flags [.], ack 13, win 342, options [nop,nop,TS val 937878602 ecr 937878601], length 0
	0x0000:  4500 0034 3449 4000 4006 0879 7f00 0001  E..44I@.@..y....
	0x0010:  7f00 0001 60ae 251d 7e78 d006 c83e d9ac  ....`.%.~x...>..
	0x0020:  8010 0156 fe28 0000 0101 080a 37e6 e44a  ...V.(......7..J
	0x0030:  37e6 e449 0000 0000 0000 0000 0000 0000  7..I............
	0x0040:  0000 0000                                ....

```

**Comment by wenjy** [comment]
ctrl + c 客户端

tcpdump

```
10:57:15.740784 IP 127.0.0.1.24750 > 127.0.0.1.9501: Flags [F.], seq 5, ack 13, win 342, options [nop,nop,TS val 938725977 ecr 937878601], length 0
	0x0000:  4500 0034 344a 4000 4006 0878 7f00 0001  E..44J@.@..x....
	0x0010:  7f00 0001 60ae 251d 7e78 d006 c83e d9ac  ....`.%.~x...>..
	0x0020:  8011 0156 fe28 0000 0101 080a 37f3 d259  ...V.(......7..Y
	0x0030:  37e6 e449 0000 0000 0103 0307 0000 0000  7..I............
	0x0040:  0000 0000                                ....
10:57:15.742568 IP 127.0.0.1.9501 > 127.0.0.1.24750: Flags [F.], seq 13, ack 6, win 342, options [nop,nop,TS val 938725979 ecr 938725977], length 0
	0x0000:  4500 0034 3de9 4000 4006 fed8 7f00 0001  E..4=.@.@.......
	0x0010:  7f00 0001 251d 60ae c83e d9ac 7e78 d007  ....%.`..>..~x..
	0x0020:  8011 0156 fe28 0000 0101 080a 37f3 d25b  ...V.(......7..[
	0x0030:  37f3 d259 37e6 e447 0103 0307 0000 0000  7..Y7..G........
	0x0040:  0000 0000                                ....
10:57:15.742588 IP 127.0.0.1.24750 > 127.0.0.1.9501: Flags [.], ack 14, win 342, options [nop,nop,TS val 938725979 ecr 938725979], length 0
	0x0000:  4500 0034 344b 4000 4006 0877 7f00 0001  E..44K@.@..w....
	0x0010:  7f00 0001 60ae 251d 7e78 d007 c83e d9ad  ....`.%.~x...>..
	0x0020:  8010 0156 fe28 0000 0101 080a 37f3 d25b  ...V.(......7..[
	0x0030:  37f3 d25b 0000 0000 0000 0000 0000 0000  7..[............
	0x0040:  0000 0000
```

**Comment by wenjy** [comment]
客户端没有发起关闭请求

**Comment by matyhtf** [comment]
在你的 strace 信息中完全没看到相关信息，请检查代码是否正确，本地单元测试无法重现你的问题

**Comment by wenjy** [comment]
好的，我用的4.3.6 和 4.4.3 这两个版本做的测试，服务端的代码和客户端的代码是一样的 4.3.6可以正常关闭，4.4.3版本不行，我暂时没发现问题在哪

**Comment by matyhtf** [comment]
@wenjy 可以给我一个可以稳定重现的 demo

**Comment by wenjy** [comment]
@matyhtf 
服务端：

```
<?php

$config = [
    'reactor_num'              => 2,     // 线程数. 一般设置为CPU核数的1-4倍
    'worker_num'               => 2,    // 工作进程数量. 设置为CPU的1-4倍最合理
    // 防止 PHP 内存溢出, 一个工作进程处理 X 次任务后自动重启 (注: 0,不自动重启)
    'max_request'              => 1000,
    // 此参数用来设置Server最大允许维持多少个TCP连接。超过此数量后，新进入的连接将被拒绝
    'max_connection'                 => 10000,
    'task_worker_num'          => 2,// task 进程数
    'task_max_request'         => 1000,
    // 防止 PHP 内存溢出
    //'task_tmpdir'              => '/tmp',
    //'message_queue_key'        => ftok(SYS_ROOT . 'queue.msg', 1),
    'dispatch_mode'            => 2,
    'daemonize'                => false,     // 设置守护进程模式
    'backlog'                  => 128,
    //'log_file'                 => '/data/logs/swoole.log',
    //'heartbeat_check_interval' => 60,
    // 心跳检测间隔时长(秒)
    //'heartbeat_idle_time'      => 125,
    // 连接最大允许空闲的时间
    //'open_eof_check'           => 1,
    //'open_eof_split'           => 1,
    //'package_eof'              => "\r\r\n",
    //'open_cpu_affinity'        => 1,
    'socket_buffer_size'       => 1024 * 1024 * 128,
    'buffer_output_size'       => 1024 * 1024 * 2,
    //'enable_delay_receive'     => true,
    //'cpu_affinity_ignore' =>array(0,1)//如果你的网卡2个队列（或者没有多队列那么默认是cpu0来处理中断）,并且绑定了core 0和core 1,那么可以通过这个设置避免swoole的线程或者进程绑定到这2个core，防止cpu0，1被耗光而造成的丢包
];

// 基本模式
//$mode = SWOOLE_BASE;
// 多进程模式（默认）
$mode = SWOOLE_PROCESS;

//创建Server对象，监听 127.0.0.1:9501端口
$serv = new \Swoole\Server('127.0.0.1', 9501, $mode, SWOOLE_SOCK_TCP);

$serv->set($config);

// 启动后在主进程（master）的主线程回调此函数
$serv->on('start', function ($serv) {
    // onStart回调中，仅允许echo、打印Log、修改进程名称
    echo 'on start event' . PHP_EOL;
});

$serv->on('ManagerStart', function ($serv) {
    echo 'on ManagerStart event' . PHP_EOL;
});

$serv->on('ManagerStop', function ($serv) {
    echo 'on ManagerStop event' . PHP_EOL;
});

$serv->on('WorkerStart', function ($serv, $worker_id){
    echo 'on WorkerStart event $worker_id->' .$worker_id. PHP_EOL;
});

$serv->on('WorkerStop', function ($serv, $worker_id){
    echo 'on WorkerStop event $worker_id->' .$worker_id. PHP_EOL;
});

// 仅在开启reload_async特性后有效
$serv->on('WorkerExit', function ($serv, $worker_id){
    echo 'on WorkerExit event $worker_id->' .$worker_id. PHP_EOL;
});

$serv->on('shutdown', function ($serv) {
    echo 'on shutdown event' . PHP_EOL;
});

//监听连接进入事件
$serv->on('connect', function ($serv, $fd, int $reactorId) {
echo 'on connect $reactorId->'. $reactorId . PHP_EOL;
});

//监听数据接收事件
$serv->on('receive', function ($serv, $fd, $reactorId, $data) {
    echo 'on receive $reactorId->'. $reactorId . PHP_EOL;

    //投递异步任务
    //$task_id = $serv->task($data);
    //echo "Dispath AsyncTask: id=$task_id\n";

    $serv->send($fd, "Server: ".$data);
});

// 接收到UDP数据包时回调此函数，发生在worker进程中
$serv->on('Packet', function ($server, string $data, array $client_info) {
    echo 'on Packet' . PHP_EOL;
});

$serv->on('PipeMessage', function ($server, int $src_worker_id, mixed $message) {
    echo 'on PipeMessage $src_worker_id->'.$src_worker_id . PHP_EOL;
});

$serv->on('WorkerError', function ($serv, int $worker_id, int $worker_pid, int $exit_code, int $signal) {
    echo 'on WorkerError' . PHP_EOL;
});

//监听连接关闭事件
$serv->on('Close', function ($serv, $fd, $reactorId) {
echo "Client: Close.\n";
});

$serv->on('task', function ($serv, int $task_id, int $src_worker_id, mixed $data) {
    echo 'on task event' . PHP_EOL;
    echo "New AsyncTask[id=$task_id]".PHP_EOL;
    //返回任务执行的结果
    $serv->finish("$data -> OK");
});

$serv->on('finish', function ($serv, int $task_id, string $data) {
    echo 'on finish event' . PHP_EOL;
    echo "AsyncTask[$task_id] Finish: $data".PHP_EOL;
});

//启动服务器
$serv->start();
```

客户端：

```
<?php

use Swoole\Client;

$client = new Client(SWOOLE_SOCK_TCP, SWOOLE_SOCK_ASYNC);

        $client->on('connect', function (Client $cli) {

            $cli->send('aaaa');
        });

        $client->on('receive',function (Client $cli, $data) {

            var_dump($data);
            var_dump($cli->close());
        });

        $client->on('error', function (Client $cli) {
            echo 'fail Connection error' . PHP_EOL;
        });

        $client->on('close', function (Client $cli) {

        });

        $client->connect('127.0.0.1', 9501);
```

**Comment by matyhtf** [comment]
请在 client 程序末尾添加 `Swoole\Event::wait()` ，否则 close 发生在 shutdown 阶段，可能导致内存异常，底层做了保护，在这个阶段不执行 close

**Comment by matyhtf** [comment]
另外，不建议使用 异步回调客户端，请使用协程 API，此模块已废弃，在新版本中即将移除。
